{
  "$schema": "http://json-schema.org/draft-07/schema#",
  "title": "AuditResult",
  "type": "object",
  "required": ["audit", "score", "iso_characteristic", "checklist", "findings"],
  "additionalProperties": true,
  "properties": {
    "audit": {"type": "string"},
    "score": {"type": ["number", "null"]},
    "iso_characteristic": {"type": "string"},
    "archetypes_applied": {"type": "array", "items": {"type": "string"}},
    "error": {"type": "string"},
    "checklist": {
      "type": "array",
      "items": {
        "type": "object",
        "required": ["id", "label", "status"],
        "additionalProperties": false,
        "properties": {
          "id": {"type": "string"},
          "label": {"type": "string"},
          "status": {"enum": ["pass", "fail", "warning", "skipped"]},
          "affected_count": {"type": "integer", "minimum": 0}
        }
      }
    },
    "findings": {
      "type": "array",
      "items": {
        "type": "object",
        "required": ["checklist_id", "file", "severity", "title", "recommendation"],
        "additionalProperties": true,
        "properties": {
          "checklist_id": {"type": "string"},
          "file": {"type": "string"},
          "line": {"type": ["integer", "string", "null"]},
          "severity": {"enum": ["High", "Medium", "Low", "Info"]},
          "title": {"type": "string"},
          "detail": {"type": "string"},
          "recommendation": {"type": "string"},
          "compliance_refs": {"type": "array", "items": {"type": "string"}}
        }
      }
    }
  }
}
